{   "schema": "agent_os.root_doctrine.v1",   "version": "r8-provider-lanes",   "postures": {     "autonomousEligible": [       "lane-bootstrap",       "repo-write",       "provider-write",       "runtime-deploy-wrapper",       "local-auth-readback"     ],     "oneTimeGrant": [       "business-write",       "runtime-deploy-live",       "local-auth-repair",       "authority-artifact-write",       "remote-branch-cleanup"     ],     "rootBlocked": [       "credential",       "identity",       "remote-delete",       "spend",       "legal",       "vendor",       "root-values"     ]   },   "recoverablePostures": [     "abandon",     "revert",     "close-pr",     "rollback",     "revert-artifact",     "restore-worktree",     "recreate-branch",     "disable-auto-merge"   ] }