{
  "schema": "agent_os.root_doctrine.v1",
  "version": "phase-0-initial",
  "postures": {
    "autonomousEligible": [
      "lane-bootstrap",
      "repo-write",
      "provider-write",
      "runtime-deploy-wrapper"
    ],
    "oneTimeGrant": [
      "business-write",
      "runtime-deploy-live"
    ],
    "rootBlocked": [
      "credential",
      "identity",
      "remote-delete",
      "spend",
      "legal",
      "vendor",
      "root-values"
    ]
  },
  "recoverablePostures": [
    "abandon",
    "revert",
    "close-pr",
    "rollback",
    "revert-artifact"
  ]
}
