{
  "schema": "agent_os.root_doctrine.v1",
  "version": "r5-worktree-retire",
  "postures": {
    "autonomousEligible": [
      "lane-bootstrap",
      "repo-write",
      "provider-write",
      "runtime-deploy-wrapper",
      "local-auth-readback"
    ],
    "oneTimeGrant": [
      "business-write",
      "runtime-deploy-live",
      "local-auth-repair",
      "authority-artifact-write"
    ],
    "rootBlocked": [
      "credential",
      "identity",
      "remote-delete",
      "spend",
      "legal",
      "vendor",
      "root-values"
    ]
  },
  "recoverablePostures": [
    "abandon",
    "revert",
    "close-pr",
    "rollback",
    "revert-artifact",
    "restore-worktree"
  ]
}
